{"experiment_id":"baseline-deterministic-preview-20260817","git_ref":"dc8f67f plus benchmark-only uncommitted files","hypothesis":"The released latest-frame-wins and two-image pacing policy will reproduce the documented 4 native / roughly 8 displayed operating point while exposing visible holds between semantic updates.","changed_variables":{},"source_scenario":"scroll + map-motion + structure; deterministic 12 s suite","metrics":{"native_result_fps":3.75,"genuinely_changing_displayed_fps":5.25,"displayed_update_fps":7.5,"interpolated_fps":3.75,"motion_compensated_fps":0,"encoded_fps":30,"median_end_to_end_output_age_ms":312.8,"p95_end_to_end_output_age_ms":436.8,"median_native_round_trip_ms":250,"p95_native_round_trip_ms":250,"skipped_or_replaced_source_samples":69,"maximum_queue_depth":2,"mean_encode_ms":1.5,"main_thread_long_tasks":null,"approximate_paid_cost_usd":0,"session_failures":0},"cost_ceiling_usd":0,"estimated_cost_usd":0,"artifact_paths":["output/realtime-rd/baseline/source-suite.mp4","output/realtime-rd/baseline/baseline-comparison.mp4","output/realtime-rd/baseline/contact-sheet.jpg","output/realtime-rd/baseline/metrics.json","output/realtime-rd/baseline/frames.jsonl"],"rubric_scores":{"responsiveness":2,"motion_continuity":2,"temporal_stability":4,"source_fidelity":4,"artifact_control":4,"aesthetic_quality":3,"truthfulness":5},"verdict":"keep as baseline","reason":"The free deterministic run preserves the release scheduling behavior, matches the expected native/displayed cadence class, and visibly retains held output between updates. It does not measure live FLUX quality or throughput."}
{"experiment_id":"motion-translation-v1-20260817","git_ref":"codex/surfaceshift-realtime-rd worktree; tracked-diff sha256 64f06ac8af7d24a67ab70d84e668c46122847d69029f8f81fd9ecbd038c3fed1 before ledger documentation","hypothesis":"A conservative low-resolution global-translation estimator can move the last model frame in the source direction between native arrivals, removing held-looking scroll and pan intervals without changing cloud throughput or cost.","changed_variables":{"presentation":"48x48 luma translation search plus edge-clamped warp","maximum_step_fraction":0.08,"maximum_warp_fraction":0.055,"native_model_configuration":"unchanged"},"source_scenario":"same scroll + map-motion + structure 12 s source; SHA-256 51b17effd53fedc25ea298c07c7495c5bfe7b2d0774424266addf758c0bfebb0","metrics":{"native_result_fps":3.75,"genuinely_changing_displayed_fps":6.83,"displayed_update_fps":7.5,"interpolated_fps":3.75,"motion_compensated_fps":2.42,"encoded_fps":30,"median_end_to_end_output_age_ms":312.8,"p95_end_to_end_output_age_ms":436.8,"median_native_round_trip_ms":250,"p95_native_round_trip_ms":250,"median_motion_response_age_ms":0,"p95_motion_response_age_ms":66.67,"skipped_or_replaced_source_samples":69,"maximum_queue_depth":2,"mean_encode_ms":1.5,"main_thread_long_tasks":null,"approximate_paid_cost_usd":0,"session_failures":0,"genuinely_changing_cadence_gain_percent":30.1},"cost_ceiling_usd":0,"estimated_cost_usd":0,"artifact_paths":["output/realtime-rd/motion-translation-v1/source-suite.mp4","output/realtime-rd/motion-translation-v1/motion-translation-v1-comparison.mp4","output/realtime-rd/motion-translation-v1/blind-ab-output.mp4","output/realtime-rd/motion-translation-v1/contact-sheet.jpg","output/realtime-rd/motion-translation-v1/metrics.json","output/realtime-rd/motion-translation-v1/frames.jsonl","output/realtime-rd/browser/cloud-mock-running.png","output/realtime-rd/browser/cloud-mock-live-compare.webm"],"rubric_scores":{"responsiveness":4,"motion_continuity":4,"temporal_stability":4,"source_fidelity":4,"artifact_control":3,"aesthetic_quality":3,"truthfulness":5},"verdict":"keep","reason":"Identical-input preview improved genuinely changing cadence by 30.1%, clearing the 20% gate. Normal-speed blind A/B showed correct scroll/pan direction and no blank seams. Brief edge stretching remains, but it was less distracting than the removed holds; the structure lane rejected motion and did not regress. Browser mock tests passed with separate model/warp labels and zero console errors."}
{"experiment_id":"async-jpeg-probe-20260817","git_ref":"measurement only; no generation-pipeline change retained","hypothesis":"Replacing synchronous canvas.toDataURL with asynchronous canvas.toBlob plus FileReader serialization will materially reduce main-thread capture stalls without a meaningful latency penalty.","changed_variables":{"jpeg_encoding":"toDataURL versus toBlob plus FileReader","iterations":40,"canvas":"704x704 JPEG quality 0.5"},"source_scenario":"current deterministic demo canvas in Chromium","metrics":{"baseline_encode_median_ms":2.6,"baseline_encode_p95_ms":3.3,"baseline_event_loop_delay_p95_ms":5.5,"candidate_total_median_ms":8.2,"candidate_total_p95_ms":9.9,"candidate_event_loop_delay_p95_ms":0.8,"candidate_total_wall_time_increase_percent":200.0,"candidate_event_loop_delay_reduction_percent":85.5,"approximate_paid_cost_usd":0},"cost_ceiling_usd":0,"estimated_cost_usd":0,"artifact_paths":[],"rubric_scores":{"responsiveness":3,"motion_continuity":3,"temporal_stability":3,"source_fidelity":5,"artifact_control":5,"aesthetic_quality":3,"truthfulness":5},"verdict":"revert","reason":"The async path reduced event-loop delay, but its p95 capture-to-data-URL wall time increased from 3.3 to 9.9 ms and no 15% age, 20% cadence, or visible-artifact gate was demonstrated. The released encoder remains unchanged."}
{"experiment_id":"paid-motion-v1-run1-20260817","git_ref":"codex/surfaceshift-realtime-rd worktree","hypothesis":"One 15-second real-FLUX run will confirm that translation compensation remains useful with genuine generated content.","changed_variables":{"presentation":"motion translation v1","flux_parameters":"unchanged"},"source_scenario":"built-in moving map/gallery demo","metrics":{"sample_fps":9.7,"native_result_fps":2.0,"native_interpolated_model_fps":4.0,"motion_compensated_fps":0.7,"p95_native_anchor_age_ms":2002,"approximate_paid_cost_usd_ceiling":0.0291,"session_failures":1},"cost_ceiling_usd":0.0291,"estimated_cost_usd":0.0291,"artifact_paths":[],"rubric_scores":{"responsiveness":1,"motion_continuity":2,"temporal_stability":3,"source_fidelity":3,"artifact_control":3,"aesthetic_quality":3,"truthfulness":5},"verdict":"revert","reason":"The run hit the selected deadline before recording was armed, and startup/load outliers produced a 2002 ms p95 native-anchor age. It is retained as a failed service-load receipt, not promoted."}
{"experiment_id":"paid-motion-v1-run2-20260817","git_ref":"codex/surfaceshift-realtime-rd worktree","hypothesis":"An armed-from-start 15-second real-FLUX run will produce an auditable Compare recording and confirm extra motion-compensated updates under genuine model output.","changed_variables":{"presentation":"motion translation v1","flux_parameters":"unchanged","recording":"Compare armed before first output"},"source_scenario":"built-in moving map/gallery demo","metrics":{"sample_fps":10.0,"native_result_fps":3.2,"native_interpolated_model_fps":6.4,"motion_compensated_fps":1.6,"independently_measured_changing_output_fps":8.2,"encoded_fps":30.01,"encoded_frames":421,"duration_seconds":14.027,"p95_native_anchor_age_ms":549,"approximate_paid_cost_usd_ceiling":0.0291,"cumulative_paid_cost_usd_ceiling":0.0582,"session_failures":0},"cost_ceiling_usd":0.0291,"estimated_cost_usd":0.0291,"artifact_paths":["output/realtime-rd/paid-motion-v1-live-compare.webm","output/realtime-rd/paid-motion-v1-contact.jpg","output/realtime-rd/paid-motion-v1-output-changing.mp4"],"rubric_scores":{"responsiveness":3,"motion_continuity":4,"temporal_stability":4,"source_fidelity":4,"artifact_control":3,"aesthetic_quality":5,"truthfulness":5},"verdict":"keep","reason":"The normal-speed real-FLUX recording was attractive and structurally stable. The output crop contained 115 changing frames over 14.027 s (8.2/s), consistent with 6.4 model plus 1.6 separately labeled warp fps. Native service cadence and p95 age were worse than the historical best, so this validates the presentation gain but does not replace the v0.4 throughput baseline or establish parity."}
